微博id,微博正文,原始图片url,微博视频url,发布位置,发布时间,发布工具,点赞数,转发数,评论数
IvcQ7m9Bu,想到一个寓言，他什么都愿意捐出了，就是不肯捐二头牛，因为他真的有二头牛。哈哈哈，好多人说送房子感恩的，和这个差不多。平常对你有帮助的人多了，你有拿出年终奖去感谢吗？女朋友对你那么好，买个包包感恩都不肯，还要骂人家物质。对伐？  ,无,2020-02-21 12:00,微博 weibo.com,237,12,48
IvcNbAgeN,我姐姐介绍我爸同事的女儿嫁给了一个普通大学生，后来那个大学生爬到了银行的行长，夫妻二个很会投资，买了不少房子，偶尔碰到他们，他们总对我说，你阿姐是我们的红娘啊！难道要他们孝敬半套房子给我阿姐才算感恩？ 这不是天方夜谭吗？  ,无,2020-02-21 11:53,微博 weibo.com,170,6,41
IvcIKwr9p,上学，买房子，好的婚姻，如果都是一个人促成的，恩情是大的，是不是大到值一套北京房子？这很难量化，如果三项中促成一项，恩情就变得没有那么高了。在我影响下买房的人不少，其中一个是我下面的小工头，开始叫他买杨思的房子，他不听去乡下盖房子，后来劝他买三林还不听，最后买到了周浦，还问我借了...全文 ,无,2020-02-21 11:42,微博 weibo.com,187,3,38
IvczOsvWG,朋友曾经介绍给我一个客户，做了一笔小业务，我给了他十个点的提成，这客户感觉和我合作的很愉快，半年后主动又找我，变成了我的固定客户，业务也越做越大。我当然蛮感激这个朋友，平时吃饭送礼不在话下，后来有一次请他们夫妻吃饭时，他老婆冷嘲热讽，意思我不够意思，应该这个客户的每一笔业务都要提...全文 ,无,2020-02-21 11:20,微博 weibo.com,264,6,74
Iv7YzymGF,伯爵您好，在您这儿看别人的故事多了，我也参与进来投稿，我是南方省会城市女，普通家庭，985本硕，已婚。目前，我个人名下在北京有八套房子，两个北京车牌。如何得到的我就不细写了，各种机会运气吧，自己也吃了不少苦，一路走来很幸运，感恩。对我成长帮助特别大的是我大伯，我从小学习好，讨大...全文 ,无,2020-02-20 23:38,iPhone X,1866,55,325
Iv7FflbGh,#牛蛙# 以后只吃牛蛙腿算了。  ,无,2020-02-20 22:50,iPhone X,23,1,9
Iv7x41cl7,伯爵叔，我今年22岁大学刚毕业，在河南读的普通二本。商英专业，学习成绩还不错，该有的证都拿到了。今年考研没有上岸。样貌还行，单亲家庭。和男朋友谈恋爱两年，也见过双方父母了，家长还挺满意。但和男朋友兴趣爱好精神方面，完全聊不来，xsh的时候他身体虚。但是他开朗善良，有责任心，对我很好...全文 ,无,2020-02-20 22:30,iPhone X,278,1,99
Iv6YVoXkr,#不将房地产作为短期刺激经济的手段#2月19日，中国人民银行发布2019年第四季度中国货币政策执行报告。央行表示，坚持房子是用来住的、不是用来炒的定位，按照“因城施策”的基本原则，加快建立房地产金融长效管理机制。央行D性强的，“因城施策”属于耍流氓！  ,无,2020-02-20 21:06,微博搜索,32,1,4
Iv6M3euxT,发布了头条文章：《如何拥有成熟的情感？征婚心得一二三四五六》  如何拥有成熟的情感？征婚心得一二三四五六  ,无,2020-02-20 20:34,微博 weibo.com,25,5,2
Iv4BCkSUM,伯爵，我喜欢的那个男生，他明确说不会做我男朋友，只想把我当炮友。我最后一点希望都没了，感觉心被伤的透透的！前期跟他发生关系我其实是因为喜欢他。但一直没有确定关系，问他也不说清楚我们的关系。现在他这样一说，我觉得是怪自己不自重。有的人说大家都是成年人男欢女爱，有的人说如果他不...全文 ,无,2020-02-20 15:03,iPhone X,641,19,177
Iv4sebwzw,给逆行者子女中考加分，是提增一线医护人员士气的好举措，“公平巨婴”哇啦哇啦反对，其实医护人员参加中考的子女数量，分摊到每个省市，数量并不多，上海排前30的高中，每年每个学校多招十个，基本就解决了。干脆步子迈大点，免试入学，也没有挤占普通家庭学籍的问题了。  ,无,2020-02-20 14:40,iPhone X,455,46,133
Iv4khlFeq,伯爵。我和老公17岁开始拍拖5年，大学毕业怀孕，裸婚，没有在国内领结婚证，领的是香港结婚证。当时他说他家生意快要破产规避负债风险。也没有举办婚礼，意思外债多不想张扬就没举办婚礼，为此我心中也有芥蒂。没有买房，一直都租房子。我们生了两个孩子，公婆爸妈都忙，所以请了保姆，做了全职妈...全文 ,无,2020-02-20 14:20,iPhone X,586,14,139
Iv4arpJHX,伯爵，在恋爱期间发现男友之前创业失败，有几百万欠款，他说不想拖累我，但是我好像已经陷进去了，他又说要回他家乡（某贫困省份的县城）发展，而我是计划留在一线或者二线城市（靠自己也有这个能力）计划分手。要分离一段亲密关系真的太难了太难了。我舍不得放手，他性格长相家庭方面都算合拍。现在怎...全文 ,无,2020-02-20 13:56,iPhone X,176,3,57
Iv45JcJ1J,老百姓需要管的，什么样的土壤开什么样的花，上海的管理文明先进，高素质的市民是土壤，看到有的地方把不听话的绑起来，大城市市民哗然，我是蛮理解的，还应该拿鞭子抽。夫妻关系也是一样，男人也需要女人管的，管的男人乐在其中，是女人的本事。  ,无,2020-02-20 13:44,iPhone X,92,15,23
Iv40TynGd,我是打心底里怀念感激邓公的。昨天没有发一条微博纪念他，是因为我发现，昨天有不少朋友是在借纪念偷渡私货，有“借古讽今”的味道，我觉得不好。  ,无,2020-02-20 13:32,iPhone X,233,4,43
Iv3SM0H0n,离婚官司中，对方要孩子，你也坚决要，对方不要孩子，你也坚决不要，这样想要的或不想要的就会在财产上补偿对方。另外抚养费，靠谱的男人，你可以要求每月多少年付，逐年增加，不靠谱的男人，还是一次性补偿好，月付的话，这家伙东躲西藏，出外打工，关手机换手机～弄的你心力交瘁。  ,无,2020-02-20 13:12,iPhone X,125,16,39
Iv3MwlpWD,我不是离婚律师，但我用常识来分析，帮大家厘清一些事实，我看好多女粉丝思路有点紊乱。如果有误，律师可以指正。1）有争议才上法院，没有争议上民政局。2）争议分二种，一种是一方不愿离婚，一种是都愿意离婚，但对财产分割有异意。3）一方不愿意离婚的，法院判决是看感情是否已经破裂，婚内出...全文 ,无,2020-02-20 12:57,iPhone X,122,23,38
IuYmK3KCl,#今年高校毕业生达874万# 鼓励创业，拿家里的钱创业，既解决了就业又拉动了消费，一举二得。哈哈哈  ,无,2020-02-19 23:10,iPhone X,146,8,35
IuYlddsqu,#韩国前总统李明博二审获刑17年#青瓦台风水不好，韩国总统没一个有好下场的，要么流亡海外，要么被暗杀，要么锒铛入狱，要么丑闻缠身～～总统是韩国风险最高的职业。  ,无,2020-02-19 23:06,iPhone X,121,2,25
IuYbJbKuE,房子过户给儿子，男的肯定不会同意的，这个儿子将来会不会变成个浑蛋谁也不知道，到时候把房子卖了，赌博，吸毒，创业，吃喝玩乐，拿他一点办法也没有。  ,无,2020-02-19 22:43,iPhone X,85,6,22
IuY9wl7NP,我看好多人对律师有误解，以为请了律师就万事大吉了，一般财产复杂并需要取证的请律师有点用，这种结婚不久，共有财产清晰的案子，请律师没有啥用。  ,无,2020-02-19 22:37,iPhone X,75,14,42
IuXXegLl7,伯爵 结婚3年 儿子一周岁 离婚中我是护士，收入稳定。老公没工作。谈恋爱的时候我家不同意，两人分手。后来他父母给他安排了工作，他又上赶着来找我，来求我母亲，说会一生一世对我好，就结婚了！婚房是他父母全款买的，写的他的名字，我家陪嫁一辆车和7万现金。婚后老公开火锅店，只开了大半年...全文 ,无,2020-02-19 22:07,iPhone X,692,21,201
IuXGT26gg,伯爵大大，我老公其他还好，就是喜欢说大话，明明只有三千万左右资产，要说有一亿。最近，我意外发现他出轨，而且是和很多女人，虽然气的发抖，但我没有掉一滴眼泪，骂了他世纪大渣男后，我让他写下纸条给我价值1千万的财产（也不知道有不有法律效应，因为吵架时写的，也没有什么格式规范），还把他和...全文 ,无,2020-02-19 21:27,iPhone X,272,10,88
IuV7661BV,【伯爵茶征婚】男，新上海人，1992，狮子座，身高178cm，体重78kg，独生子，上海211硕士毕业，目前从事海外工程，税后收入30+。房子买在宝山，另外在松江有一套公寓，代步车一辆。爱好：Popping，篮球。老家在皖西北，父母均是从事教育的公务人员，事业编制。老家有房5套。希望女方：91到96，落...全文 ,无,2020-02-19 14:53,iPhone X,94,7,103
IuUW2eLHB,女人比男人更好色，而且毫不掩饰，80年代费翔在电视机里出现，办公室里的女同事老的少的全部涌在屏幕前嗷嗷叫。现在也一样，先是韩国欧巴，后是国产小鲜肉，女人都不加掩饰嗷嗷叫，甚至有高呼“快来草我”“我要跟你生BB”的。大概嗷嗷一叫就算发泄了。男的不行，男的嗷嗷叫要被当成十三点的，他们只能...全文 ,无,2020-02-19 14:26,iPhone X,269,23,71
IuUQBmj2V,昨天和老婆吵架，老婆主动讲和，我就来劲了，说：我不想睬你。老婆笑着说：“好的，不睬就不睬，那明天早饭你自己弄吧！” 我一听，噢要不对，不睬的成本太高了，只好说：睬的睬的！  ,无,2020-02-19 14:12,iPhone X,245,5,46
IuUKGlQ4A,爷叔，我是985普女，父母离婚后又各自成婚生子，导致我现在有两个弟弟一个妹妹(都是同父异母同母异父)，感觉这种配置会影响我未来择偶，也会拖累我一辈子，该如何突围？【拖累到不会，就是你父母不会对你成家有大的经济支持，鸡贼男会止步，但好处是，以后岳父母也不会烦到你老公，清清爽爽少了好多...全文 ,无,2020-02-19 13:58,iPhone X,130,4,31
IuUHK6ivZ,伯爵叔，我今年24啦，上了个职高19岁就出来工作了，文员，我比较内向自卑，这两年一直因为学历烦恼，当时不读书纯属是因为笨，成绩差，前年报了个成人考，但不是全日制也没什么用，总有人问，刚刚大学毕业吗巴拉巴拉的一堆，有的还要教育我怎么不继续读书呀之类的，心里特别不舒服。谈恋爱更别提了，以...全文 ,无,2020-02-19 13:50,iPhone X,170,4,42
IuUD49m08,爷叔，我和现任都是上海本地人，我离婚未育（婚姻存续期间约为一年），目前交往数月，已见过双方父母。不久前无意中发现男友有劈腿前科（平时相互都会查看手机），并已得到证实（恋爱前并未坦白），我觉得人都有过去，尽管他表示和我在一起后没有劈腿过，但心里总是有芥蒂。我觉得他道德感模糊，本...全文 ,无,2020-02-19 13:39,iPhone X,119,3,35
IuUyryaC1,男人女人都有一颗异动的心的，不管是结婚前还是结婚后。男人找刺激比较容易，街头排档还是外滩料理，丰俭由人。女人比较困难，说找鸭子找小鲜肉嗨皮，只是嘴巴说说，真要找，一个是口袋深不深，就算口袋深大多数人也不知道门开在哪里？难度比男人高多了。  ,无,2020-02-19 13:27,iPhone X,174,15,100
IuUhhdOaU,大多数人能看出来，并且大多数人都能参与的，那就不叫机会了。  ,无,2020-02-19 12:45,微博 weibo.com,105,14,23
IuUgJtEA5,#上海楼市# #抗击疫情 房地产在行动# 疫情发生前，房地产调控政策有松动已经很明显了，强调因城施策，其实是要面子，不肯自己打自己脸。上海最乖，考虑到全国一盘棋，我预计是最晚“因城施策”的，因为上海一松动，资金大都往上海涌了，疫情发生后，就有了变数，上海应该也会出台保持三稳的政策的。  ,无,2020-02-19 12:44,微博 weibo.com,50,7,21
IuUcUtujh,#上海楼市# #抗击疫情 房地产在行动# 有人问我疫情之后房地产会怎么样？ 我先问问你 “稳地价，稳房价，稳预期 ”这三稳政策会不会变？如果不变的话，要怎么稳？ 金融政策，限购政策会不会有变动？变动后市场会买账吗？ 自己想一想就清楚了。  ,无,2020-02-19 12:34,微博 weibo.com,42,5,13
IuU7QpJWF,举了皮裤汪大头松的例子，有人就说“哼！文艺界呀 ” 好像只有文艺界很乱样子，金融业不乱啊，还有人讲医生和老师也乱的，说医生和护士搞不清爽，老师和家长搞不清爽，最没被污名化的是IT男，不知道什么时候开始的，IT男竟然成了“老实男人”的代名词了，我的了解，IT男好好叫~~不说了，IT男也不容易。  ,无,2020-02-19 12:22,微博 weibo.com,106,1,53
IuU12bF5a,总结一下昨天的“募款”贴，在中国，想要表达中日友好，不能举太阳旗，不能穿和服，要被打的。伯爵建议，可以穿成 阿童木，奥特曼，机器猫，或者穿成柯南，小新~~就算打扮成美少女战士或者苍老师的样子，也比和服好。  ,无,2020-02-19 12:05,微博 weibo.com,92,6,25
IuOVoB6yX,伯爵好，我94年，男友87 。我苏州的，他上海。 亲戚和他同事多年，觉得他人不错，牵了下线。交往近一年，他性格温吞，待人接物有礼貌，做事没有主见。我性格爽快，平时还好，被烦了脾气不好没耐心。外人看我俩不错，我觉得跟他还有很多问题待解决。聊工作，都是我决定就好，他支持我。去自驾玩，都是...全文 ,无,2020-02-18 23:08,iPhone X,554,9,140
IuOKvo8ON,发现一个现象，男人只要有实力，再渣也没关系，皮裤汪，大头松～换老婆跟换衣服一样，喜欢他们的女人从来没有少过，“爱憎分明”的女网友照样喜欢他，你底层，穷，丑，不要说换老婆，就是去推个油，也会被网友口水喷死。对伐？哈哈哈哈哈  ,无,2020-02-18 22:41,iPhone X,309,12,90
IuOGQaqQb,伯爵叔，我老公做小生意，我坐月子的时候发现他出轨ktv陪酒女。以前很老实，前段时间结识了些不好的人，叫他不要跟那些人来往，嘴上答应私底下还在来往，还不承认做了对不起我的事，现在一直在冷战，宝宝2个多月。我自己也有工作，在十八线小县城工作稳定，月入上万➕，颜值身材也可以，我想离婚，但是...全文 ,无,2020-02-18 22:32,iPhone X,446,13,167
IuOydAsCB,伯爵，咨询一下情感问题，我和老婆是大二认识一直谈到研究生毕业，基本算是初恋，目前领了证还没办婚礼，年前我家人凑钱付了房子首付。上学时我俩基本异地，去年毕业同居了半年，新鲜感越来越少，我们双方开始对这段关系有了犹豫，我目前的状态是习惯大于了爱，觉得这么多年都过来了应该是合适的，可...全文 ,无,2020-02-18 22:10,iPhone X,325,17,94
IuNa6FpEk,日本东京女孩，寒风中，穿旗袍深鞠躬为武汉募款，感动了无数的中国网友，现在，日本防疫也很严峻，如果中国疫情结束，日本正严重，一个上海女孩，穿着和服在淮海路上为日本募款，大家会怎么看？  ,无,2020-02-18 18:38,微博 weibo.com,717,13,213
IuLhH1XI5,伯爵，我结婚7年，儿子3岁，全职带娃。老公出轨了一个22岁的小姑娘。自己主动跟我坦白了，他出轨的动机是图新鲜刺激，小姑娘年轻漂亮会撒娇。我自从生孩子后跟他分床睡，一心顾着孩子，夫妻生活他也不太满意，我自己也没当回事。总之，就算出轨他也从来没想要抛妻弃子。他觉得他反而会对我们更好，...全文 ,无,2020-02-18 13:51,iPhone X,1998,50,347
IuKRrr1xs,哈佛大学有个研究，挑选了各个阶层的724个小孩，从15岁开始，跟踪了75年，现在还继续跟踪他们的儿子孙子。得出一个结论，善于处理人际关系的，事业成功概率高，单身的比结婚的寿命短，夫妻越恩爱寿命越长。与贫富无关。网上趣事的微博视频  ,无,2020-02-18 12:47,微博 weibo.com,348,316,56
IuKO5DppZ,一个电影院小美工，一个医院小护士，结婚成家，原本就这样平平淡淡风雨同舟过一生，和大多数普通家庭一样。但一个成了大导演，一个还是小护士，还有共同语言吗？还相配吗？一种是不爱了，但基于良心和社会舆论，夫妻名存实亡，一种是不爱了就说出来，背负骂名也要离婚。哪一种处理比较好呢？  ,无,2020-02-18 12:39,微博 weibo.com,246,8,68
IuKJE1ovc,钟南山教授很了不起，但现在有将他神格化的趋势，对钟教授本人来说并不是好事情。  ,无,2020-02-18 12:28,微博 weibo.com,350,7,68
