微博id,微博正文,原始图片url,微博视频url,发布位置,发布时间,发布工具,点赞数,转发数,评论数
IvQuPxgHs,#楼市杂谈#  “ 房住不炒 ” 是天条，谁也不能动的，随之衍生出一系列严控政策，慢慢发现市场有了变化，天条是不能动的，就弄出来一个“ 因城施策 ”，其实是在修正了，一线城市属于于“炒房”的政策，在其他城市尤其是非限购城市，变成了惠民政策。最近都在偷偷摸摸出台，嘴有二张皮，随便怎么翻。  ,无,2020-02-25 16:58,微博 weibo.com,69,6,35
IvQo9ARru,加名字后离婚，有的律师说，不要紧，你把当时付款证明拿出来就行了。有的律师说，拿出来也没用，当时加名字算是赠与行为，如果没有约定份额，就是一人一半。很想听听法官怎么说？但微博上查不到。  ,无,2020-02-25 16:41,微博 weibo.com,175,19,70
IvPfr64zX,二十多年前，23岁的青岛女孩纪然冰认识了58岁的台湾电子业富商彭增吉，三年后在洛杉矶生下一个儿子。儿子五个月时，纪和儿子在洛杉矶被原配林氏杀害。林和彭的儿子当时在洛杉矶留学，警方怀疑他也有参与谋杀案，后因证据不足排除。彭增吉出高价委托律师帮林氏辩护，林在美坐牢7年后被保释。案件扑...全文 ,无,2020-02-25 13:47,iPhone X,1579,45,223
IvOZZ5s4N,伯爵，谈了个男朋友五个多月，就想睡我，我不敢，我怕对以后有影响，，冷战中，我也不知道怎么办了，是要分手还是怎样，大家给给意见嘛【你不喜欢他，分手算了，又不是五天就想睡你，五个月不想睡你的男人你敢要吗？吓人的哦。】  ,无,2020-02-25 13:09,iPhone X,452,15,133
IvOWrfUvc,这么多互联网大佬，只有一个东哥喜欢玩女大学生？你相信吗？我是不相信的，但只有东东一个人惹上了强奸官司，东东自己要不要检讨检讨？骂他是为他好。  ,无,2020-02-25 13:00,iPhone X,272,8,48
IvOOeFvNJ,伯爵，按你的标准，强哥也是好男人啊，你为啥老是要骂他？【东哥纯花插插我不骂的，他花到全世界都知道，还不肯花钱摆平，就该骂，奶茶也要面子的呀！】  ,无,2020-02-25 12:40,微博 weibo.com,126,5,23
IvOIwpuxR,什么是好老婆标准：1）不出钱不加名字，2）陪老公打游戏，3）不作不闹不和她同学老公比，4）没有虚荣心一只包包背十年。5）风骚浪漫有技巧，6）相夫教子家务全包。7）真心对婆婆好。哈哈哈哈，是不是？  ,无,2020-02-25 12:26,微博 weibo.com,330,31,118
IvODBui70,我问老婆，马云是好男人伐？老婆说，马云当然是好男人，这么多钱，不好也好了，但你肯定不能算好男人。我再问：那你心目中好男人的标准是啥？ 老婆说：1）上交工资，2）陪我逛街陪我追剧，3）争吵后主动道歉，4）听话听音接我翎子，5）风趣幽默懂浪漫，6）帮我一起做家务。我：  ,无,2020-02-25 12:14,微博 weibo.com,156,14,63
IvOvolvIB,电影《美国之子》，非常有意思，整个电影只有一个场景，二个白人二个黑人，情节推动全部靠他们之间的对话，一个半小时的电影没有尿点。主要讲种族问题，黑人内心的自卑，敏感，玻璃心~~已经存入在血液中，白人彬彬有礼，也是鸡同鸭讲~~电影描述的非常细腻和深刻，换成本地人外地人，其实也是如此。  ,无,2020-02-25 11:54,微博 weibo.com,86,18,18
IvOnK5fl8,伯爵，投稿，我是普通家境上海女，211本科，老公比我大10岁外地人，认识的时候我30未婚，老公40离异。老公是上海一家法国公司的采购总监，年薪80万，离异后房子给了前妻，在我家的老破小里结了婚。想着过个几年，再置换一套大点的学区房。二年前，有人举报，老公猜是副总监，举报老公吃回扣，虚报差...全文 ,无,2020-02-25 11:35,微博 weibo.com,511,18,105
IvNZD9orr,好男人 都有漂亮学历马云：嗯？好男人 都五官端正马云：你妈个六儿好男人 都不讲粗话直到马云和柳传志聊天的视频流传出来好男人 都洁身自好直到马云和高晓松去会所的视频流传出来好男人 都不喝酒不抽烟直到马云端着威士忌叼着雪茄照片流传出来是不是好男人，主要是看伊房子买好了伐对...全文 ,无,2020-02-25 10:36,微博 weibo.com,171,18,43
IvNh0cA81,打高尔夫最好，不但能锻炼身体，还是出轨的好掩护，“打球去了”，“打球不接电话”，“去XX打球，飞机去，三天后回来”～～ OK伐？女人也有的，等会说。  ,无,2020-02-25 08:46,iPhone X,127,5,37
IvNdsmFif,今天，老婆看了看我头发，讲：侬想想好，留还是勿留，侬个卖相，列宁是勿可能的，最多李九松。  ,无,2020-02-25 08:37,iPhone X,74,1,38
IvNbBFfG1,伯爵，想问你，“没有所谓的情商低，只是人家不够喜欢你。” 您觉得这句话说得对不对？【对的，开法拉利的情商都比较高。】  ,无,2020-02-25 08:32,iPhone X,103,7,15
IvN9Mcllc,伯爵，一般女的要求男的“无不良嗜好”，到底是指什么？是不抽烟不喝酒不打游戏？那我喜欢喝茶算不算？开销比他们抽烟喝酒还大。【女人眼里，要花钱的爱好都是不良嗜好不务正业，赚钱给女人花才叫正业。OK？】  ,无,2020-02-25 08:28,iPhone X,146,4,59
IvIZMmBNV,古人说：人无癖不可与交，以其无深情也；人无疵不可与交，以其无真气也 。意思是：一个人没有很深的癖好，不可跟他交往，因为他没有用情很深的东西，一个人没有缺点，不可以跟他交往，因为他比较虚伪。懂什么意思了吗？女孩子找男朋友也要这样，“样样好”的男人，可能就是个白开水伪君子。...全文 ,无,2020-02-24 21:52,微博 weibo.com,270,67,45
IvIuS5QUX,十几年前，深圳有个案列，小夫妻双方都来之外地，有个女儿，结婚时男方父母出资100多万，贷了50万，写了夫妻二个人的名字，公公婆婆和他们住一起。男的大公司高官，收入不错。没想到，年纪轻轻出车祸死了。没多久，媳妇就把公婆赶出去了。公婆气不过起诉，首先儿子明的遗产，只是房子的一半，另一...全文 ,无,2020-02-24 20:36,微博 weibo.com,1408,16,307
IvIiGcmPO,伯爵您好，我跟老公经济，生活，家务，带娃都算配合默契。经济大权也在我这。外人看起来我们生活很美满幸福，其实没有啥亲密感，当初结婚也不是因为爱情，就是觉得条件适合。上海两套房子杭州三套房子。经常度假。我娘家家境比婆家要好。但老公收入高。问题是跟老公感情比较淡，不会倾诉或者想念。...全文 ,无,2020-02-24 20:06,iPhone X,370,11,153
IvIaB5idf,伯爵大人，还是我。那个被我“作”走的老公原来外面早就有小三，突然离家出走是外面三怀孕了。现在三临产在即，渣男想回归了，这几天把公司财务大权都要交给我管，保证和外面三断（私生子怎么处理就不知道了）。想来伯爵真是神预言，从他搬走到今天正好半年。我一个人带娃有收入（年入50万左右，上海有...全文 ,无,2020-02-24 19:46,iPhone X,500,4,91
IvHE15Hg4,#上海楼市# #抗击疫情 房地产在行动#  外地朋友想要在上海买房，需要满足二个条件，连续交社保五年和结婚成家。也就是说单身就算交满五年，还是不能买房。北京单身可以，上海是不是比北京还要“不人道”？因城施策，会不会把这个先施一下呢？  ,无,2020-02-24 18:26,微博 weibo.com,84,10,58
IvHC5pQTP,#买房# #浙商银行调降非“限购”城市首套房首付比例#  非限购城市，这是在害人，哈哈哈，是帮房地产商回笼资金，不是帮你。  ,无,2020-02-24 18:21,微博搜索,32,3,8
IvHiNvpXt,我不太看好痘印，主要是痘印的内容抄来抄去，重复的多，一个哏，一个段子，好多人在用。我已经看了十几个“最穷的同学最后是董事长”的，七八个“叫妈妈或者爸爸跪下来赔衣服，然后儿子是老大”的，一百多个“你是王阿姨介绍的吧？”，一千多个跳“站在草原望北京”~还有就是脱口秀，问台下观众你...全文 ,无,2020-02-24 17:34,微博 weibo.com,63,1,21
IvHcacnnZ,现在男孩打游戏和我们那时候打麻将差不多的，不喜欢打游戏还算男人吗？ 我们年轻时，正常的男人，几乎都喜欢看足球，打麻将，看A片，追漂亮女孩~~ 宅男宅一点可以的，宅到不正常就吓人了，30岁，除了打游戏看AV，没有好哥们，没出过上海，没有过女朋友~，心理绝对是有毛病的。  ,无,2020-02-24 17:17,微博 weibo.com,153,18,76
IvGaBepFF,伯爵老师好～最近被一件事困扰许久，不知能否有幸让大家出出主意。婆婆叫我老公在老家买套房子给她养老，他想房子写婆婆名字，我希望可以写他或女儿的名字。该如何转变他的想法呢？婆婆有三个儿子，我老公是老小，前面两个不太挣钱，老跟我们借钱，不指望他们还，公公婆婆分居，婆婆说公公都不给...全文 ,无,2020-02-24 14:41,iPhone X,256,7,56
IvFWYqnNq,昨天千聊有干货的哦～～  原图 ,无,2020-02-24 14:07,iPhone X,9,2,0
IvFKqnDXg,#28年前南医大女生被杀案告破# 同学破案说法已经辟谣了？  ,无,2020-02-24 13:36,iPhone X,50,0,23
IvFx8xB1U,伯爵，你觉得92年的男生，从来不跟兄弟出去玩，活了快三十年没有出过上海，极度宅，除了上班就是回家，当然也从来没有女朋友，其他方面目前看都正常，最大可能会有什么问题？他父母人很好，家庭条件工作都还可以，亲戚把他介绍给我，我有点吓牢牢，也说不出为什么。伯爵，要不要跟他继续交往，增进...全文 ,无,2020-02-24 13:03,iPhone X,227,1,94
IvFuWCDnd,爷叔好！有个事情想咨询您下。我88年出生，在南京工作，有一套500万的房子一辆50万的宝马，另外还有大概600万的存款。今年要调到上海工作，估计工资税前80万-100万左右。不知道我这个条件能在上海找到条件不错的小姑娘嘛？另外我名牌大学本科毕业，个子1.7算是硬伤，但是经常健身，身材蛮好。希望...全文 ,无,2020-02-24 12:58,iPhone X,240,10,111
IvFsPrepH,伯爵，我嫁人后，我妈觉得我老公的哥哥很不错，促成了大哥和我表妹的婚姻，表妹成了我亲大嫂。大哥后来事业很成功，赚钱能力那是杠杠的，钱全部交给大嫂管理，买了五套大房子，两台车。我妈帮我们带两外孙带了十几年，身体不好早逝，我老公不太会做生意，没买房，各种欠账，到处借钱。大嫂一直感...全文 ,无,2020-02-24 12:53,iPhone X,817,12,199
IvFkvuyWO,昨天发的那条“100万没房”微博，讨人厌了，有个女性朋友，好像是情感博主，很不满，来骂我：“我他妈的也是服了，这种三观不正的傻逼博主竟然还这么多人关注，现实中就是个屌丝吧！我很少看他发的东西，偶尔刷到几条觉得简直是吃相太难看了，真正有钱的绝对不会是他这种思想，我父母一直告诉我...全文 ,无,2020-02-24 12:32,iPhone X,136,2,71
IvygkxiEh,本来想疫情期间反正不见人，就留胡子玩，准备留个鲁迅，留了蛮好了，汰浴辰光刮面孔，一恍神，剃须刀就上去，鲁迅变鸠山，格总归勿像腔额，只好刮刮清爽拉倒，留胡子失败，有眼挖塞，格么就开始留头发，头发长了蛮快额，再过一额礼拜，就变列宁了。  ,无,2020-02-23 18:33,微博 weibo.com,90,1,41
IvxpnChVT,今天晚上，月老伯爵和你们聊心得。存图v心扫码进小程序，快～～～哈哈哈  原图 ,无,2020-02-23 16:22,iPhone X,18,2,11
IvxfA7SYb,96年的，年薪30万，非常优秀了。说他弱鸡平庸的，你觉得96年应该拿多少算优秀？35岁拿100万无房户么优秀优秀穷叫！96年30，很有可能35岁也拿到100了，还有绿卡。还有说30万能给女孩多少物质？买点咸的甜的穿的挂的没问题吧？再说儿子手头真紧了，父母会不给吗？钱放在家里看的？对伐？  ,无,2020-02-23 15:58,iPhone X,270,4,101
IvwSNnsue,说买2千万的房子最尴尬，是我的真实体会。我找我的御用中介，让他找房源，限卢湾（不要杠，我儿子有张房票）他就跟我说：爷叔，2千万最尴尬。事实证明确实尴尬，嘉御庭蛮喜欢的，2千万只能买套小房子，复兴龙御不喜欢，建国里和融创现在都是大房型，3，4千万起，能买的只有老楼盘，淡水湾，永业这种...全文 ,无,2020-02-23 15:02,iPhone X,347,28,223
IvwGazTXg,伯爵，请教您一个问题。我96年已有绿卡，现在上海，年薪30万，家里上海房产+理财1个亿。父母意思要找门当户对的，女方资产不少于2千万，周围没有合适结婚的女生。我知道恋爱也是一项技能需要锻炼，有我喜欢同时也喜欢我的女生，但我知道和她结婚是不可能，物质上我愿意多付出一点，谈一谈算渣男伐？...全文 ,无,2020-02-23 14:31,iPhone X,564,11,148
IvwzSgwfr,微博是个舆论场，有各式各样的博主，各式各样的观点，大家可以挑自己喜欢的去关注，觉得好的点个赞（有人说我粉丝是买来的，理由是70万粉怎么点赞这么少？）觉得不好就取关，各自安好。你威胁说你再这样我就取关你唠！试图改变我的风格，你想想，可能吗？你威胁取关我会失眠？  ,无,2020-02-23 14:15,iPhone X,182,2,50
Ivwrn5X8H,我早就说过，谈恋爱，如果你对对方很满意，对方100%是不会满意你的，只有你勉强满意对方，对方也勉强满意你，才是天造地设的一对，然后各自装作很满意对方的样子，最后修成正果。  ,无,2020-02-23 13:54,iPhone X,1392,472,152
IvwoeoSLk,@飞鱼X先森：人家没房，你就瞧不起人家?你是有多势利，这是什么价值观?【我错了，房住不炒，租售同权，无房光荣。】  ,无,2020-02-23 13:47,iPhone X,86,3,33
Ivwd7zkMN,【伯爵茶征婚】女生，92年，161/50。上海人，本科毕业，名下有两套房产，家人经商，在自己家公司上班，无养老负担。热爱生活，性格随和，活泼开朗，喜欢旅游和游戏。外貌麻烦伯爵打分吧希望对方：有责任心，善良，有自己的兴趣和事业。长相干净，喜欢小动物。对于房车没有要求，年龄上下5岁都可...全文 ,无,2020-02-23 13:19,iPhone X,276,2,171
Ivwa1w2iY,伯爵，我女，27岁，和前男友异地，为他放弃了很多，最终没能修成正果。现有一男比我大六岁，命理上犯六冲，和前任相比差太远，接触大半年，他和我提过婚事，我心有不甘，半推半就，未答复。因我现在接触的其他男孩，要么条件不好，要么就是特别不喜欢。现在这个犯六冲，条件过得去，就是没有上进心...全文 ,无,2020-02-23 13:12,iPhone X,246,10,64
Ivw3c4TIe,按道理，男性有男性立场，女性有女性立场，为啥有时候发现，男的立场和男性完全相反，女的立场完全和女性相反。很简单，因为男的家里有个女儿，女的家里有个儿子。哈哈哈。  ,无,2020-02-23 12:55,iPhone X,107,4,25
IvvRKAVvN,常常有人批评对方“你太现实了”，“难道就没有感情了吗？”，成人世界，还是现实点比较好，有钱人崇尚“诗与远方”，显得高级有情怀，穷人也崇尚“诗与远方”，要么是神经病，要么是狡黠，想骗年轻涉世未深的女孩子。  ,无,2020-02-23 12:27,微博 weibo.com,215,22,40
IvvKUx75K,上海小姑娘，找了个税前年薪一百万但没有房子的男朋友，大家觉得年薪1百万很厉害了，确实厉害，如果是上海男孩，家里再有套1千万+的婚房给他，很吃香了。没房就不一样了，到手60万，一年花销10万，日子非常苦逼了（在上海）能存下来了50万，存满5年（房价不变的情况下）250万做首付，才能买套800万的...全文 ,无,2020-02-23 12:10,微博 weibo.com,751,79,288
IvvtQnh2L,在上海拿2千万出来买房子，是最尴尬的，买内环中心选择余地很小，好一点的，要3千万左右，单价12万一平的，150平的三房，就要1千8百万了，加个车位，就是2千万，还是十年前的旧房子，如果想新一点，同样地段的要15万一平，加上车位只能买100平多一点点的房子，还是建筑面积，是不是小了点？  ,无,2020-02-23 11:28,微博 weibo.com,258,20,173
Ivvpwoqqt,昨天看了二集《安家》，和美剧韩剧日剧比，《安家》就是狗屎，剧本烂表演烂，里面的人个个像十三点，电影明星看不起电视明星，是有道理的。  ,无,2020-02-23 11:17,微博 weibo.com,289,8,88
IvvjCxNoP,纽约曼哈顿，有没有别墅？因为寸土寸金，拆迁后都盖高楼公寓了，公寓比郊区的别墅还贵，曼哈顿还有不少联排别墅，类似于《纸牌屋》安德伍德住的那种，价格不菲，独栋的别墅非常少，因为价格，对于99%的人来说，它等于不存在。现在的上海有点类似，市中心的别墅好是好，也等于不存在。  ,无,2020-02-23 11:03,微博 weibo.com,72,3,28
Ivvi1hupS,先声明一下，我一般说的房子价格，生活水平，男女关系~等等，都是上海标准，不懂的话，静静的看就好了。  ,无,2020-02-23 10:59,微博 weibo.com,90,3,22
IvpQLoXo9,#华南海鲜市场并非新冠病毒发源地#据中国科学院西双版纳热带植物园官方网站消息，华南海鲜市场并非新冠病毒发源地。这个热带植物园靠不靠谱？中国科学院为它背书了没有？我觉得大家还是听CDC的比较好。  ,无,2020-02-22 21:08,iPhone X,112,3,44
IvpC2lV7c,大家都说疫情让人感觉，还是别墅好，可以在院子里走走，也没有坐电梯的危险。我一个有外环别墅也有内环楼房的朋友说，那是放屁，别墅区冷清的要死，好像与世隔绝，死了也没人知道，内环楼房，站在阳台望出去，马路上有车开来开去，小区里有人走来走去，证明自己还活着，没有变成鬼。  ,无,2020-02-22 20:31,iPhone X,655,32,170
Ivp3r3nQs,爵叔，关注您很久了，想咨询下北京这样的城市女孩子陪嫁多少算正常？150w，少么？我家是省会城市，我们那女孩子陪嫁有的只是走个形式，没有规定数额的要求。【北京的我不清楚，上海女孩陪嫁150W应该算不错了。】  ,无,2020-02-22 19:06,iPhone X,228,5,102
Ivp2Kv3tC,伯爵，我一月初在深圳宝安买了房子，540入手现在市值600，不过这些都是其次了，入手之后压力很大，月供2万，车贷5千，生了三个孩子，每个月家庭开销过万，还不包括孩子学费等等。我月收入达到十到几十万，但是非常不稳定，现在出现了疫情，收入几乎为零，甚至之后可能会完全黄掉，老公稳定工资，月入...全文 ,无,2020-02-22 19:05,iPhone X,171,7,93
IvosNzPj3,BBC 暗访教士：伊拉克秘密性交易 水山水山水山的微博视频  ,无,2020-02-22 17:36,微博 weibo.com,205,123,38
Ivok9jmaa,俄罗斯纪录片《中国的重生》第三集，上海  龙虎豹officel的微博视频  ,无,2020-02-22 17:15,微博 weibo.com,66,64,10
IvnLrwD1E,如果你是伯父，侄女送你儿子一套房，你会1）坚决不收。2）假意客气一番，收下。3）欣然接受。  ,无,2020-02-22 15:49,iPhone X,266,4,126
IvnkrhM5e,露天停车场，和朋友躲车上一起抽雪茄，这个时候一起抽，算生死之交了伐？  [组图共4张] 原图 ,无,2020-02-22 14:43,iPhone X,187,2,70
IvmMprqv3,遇到女方家长女儿结婚一分也不肯出的，感情深的，会想，她这什么父母啊，太可怜了，我要好好待她。感情浅的，会想，这种家庭出来的，吃不消的，对不起了，还是分手吧。  ,无,2020-02-22 13:19,iPhone X,424,60,81
IvmKOa7sP,没有堂吃，没有收银，APP下单取货。  [组图共4张] 原图 ,无,2020-02-22 13:15,iPhone X,38,1,13
IvmvVCarv,邓丽君张曼玉都有小奶狗，而且是白奶狗，幸福吗？只有她们自己知道，要我看，章子怡比她俩要幸福100倍。  ,无,2020-02-22 12:38,iPhone X,445,10,99
IvmsloMqu,看到好多女粉说，有房有车收入高，干吗还要结婚呢？还想嫁离异的？找小奶狗玩不好吗？ 是呀，我就想问问章子怡：你为啥脑子还不如女粉丝呢？  ,无,2020-02-22 12:29,iPhone X,338,9,75
IvmkurFyJ,一般什么样的家庭，女儿结婚父母一分钱也不肯出的？  ,无,2020-02-22 12:10,iPhone X,427,7,185
IvmbM2c39,我家的吴清华把青团也买回来了～  原图 ,无,2020-02-22 11:49,iPhone X,73,3,29
Ivm3geMMl,女主和大伯，和老公，是有真感情的，女主的任何做法，大伯都不会不开心的。相爱的人才会首先考虑对方感受，老公怕老婆为难～侄女怕大伯为难～这是最感动人的地方。没有感情的才会计较多了少了。  ,无,2020-02-22 11:28,iPhone X,198,8,42
IvlX8eO37,送弟弟一套房子的故事，女主起先送100万，如果大伯婶婶弟弟表现出很开心满足的样子，会怎么样？就不会有后面的房子了，所以说，婶婶才是拿到房子的功臣，如果婶婶善良知足，就是100万，婶婶刻薄贪婪，才有了一套房，仔细琢磨琢磨。  ,无,2020-02-22 11:12,iPhone X,218,6,58
Ivhamg0uN,#日本新冠肺炎确诊人数达737人# 中国的基层组织很严密的，“支部建在连队”这种日本是做不到的，看看上海，街道小区管的有条不紊，市民自律又高。祝福日本平安。  ,无,2020-02-21 23:01,iPhone X,245,10,46
IvgJUzjX4,我决定过户一套房子给弟弟了。哇！谢谢伯爵帮我出主意讲道理，也谢谢网友们的关心，留言我都看了，虽然我们未曾谋面但依然感受到了极大的善意，我很感动，谢谢伯爵和网友们。针对网友的一些疑问，我先讲下我大伯那边的基本情况。我大伯一家在我老家算是比较体面的人，市中心有一套大平层，郊区有一...全文 ,无,2020-02-21 21:56,iPhone X,1527,37,319
IvgaHsJRF,#日本新冠肺炎确诊人数达737人# 已经有定居东京的上海朋友逃回上海了，吓死了，还是上海的制度优越，群策群防，众志成城。需要居家隔离14天。  ,无,2020-02-21 20:29,微博搜索,5412,63,490
IvfWLp0DG,伯爵，我是上海人，94年男生，家庭净资产2000万吧。英硕毕业，年入20多万。 有个谈了两年的女朋友，感情很好。 女朋友同年，瘦高，长相6分。但结婚的话她家里一点钱都不会出。她自己也没有积蓄，我在思考该不该坚持这段感情，还是听从父母，简单点找个门当户对的。【谈了二年了，有感情的话不要轻易...全文 ,无,2020-02-21 19:55,iPhone X,522,20,257
IvfUdnqAM,伯爵亚叔，我95年女生，上海人，一本毕业，月薪税后1w+。男朋友新上海人（直辖市之一）比我大十岁，前两年在美国读了mba，年薪税前100w。我们努力在朝结婚方向发展，男朋友他母亲在他很小时去世，父亲后来再娶，又有一个儿子，他父母明确表示没法资助他结婚。而我妈对于男方无房很有意见，一直表示...全文 ,无,2020-02-21 19:49,iPhone X,296,7,103
IvfPex0MI,伯爵，我厦门人，95女，月入1万，家里一套房和父母自住，还有一套50平的单身公寓，都在市中心。暧昧对象90年，周边城市人，在厦门工作，月入1万5。男生人品也不错，家境小康，考虑未来如果走到一起，在厦门买房对于周边城市的人来说压力不小（市区房价6、7万，他老家1、2万）。住我的单身公寓的话也...全文 ,无,2020-02-21 19:37,iPhone X,136,7,63
Ivdk7u8If,我一个同学，父母没啥文化，他受宣传李四光的影响，一门心思要考地质学院，在长春，班主任老师急啊，三番五次上门劝说，终于说动他学了气象，夸张一点说，现在上海的天空是他在管，班主任是不是贵人？应该怎么感谢报答？班主任老婆说应该送她儿子一辆奔驰，不算过分吧？  ,无,2020-02-21 13:14,iPhone X,255,10,61
IvdbJ7qKy,星巴克开了有二天了，买二杯，喝一杯扔一杯。哈哈哈  原图 ,无,2020-02-21 12:54,iPhone X,83,3,31
Ivd0cke7o,马云的成长路上有没有贵人点拨和相助？肯定有的，需要拿财产的八分之一报答吗？那个澳大利亚朋友，马云给他个10亿美金，不算过分吧？  ,无,2020-02-21 12:25,微博 weibo.com,149,9,39
IvcWD2Ze8,看的出来，投稿人对伯父是感恩的，只是感恩不如婶婶的预期，双方有落差，侄女感觉到了，以后还可以弥补。伯父视如己出，关心备至，肯定不是单方面的，有亲情的关系，也有侄女聪明伶俐的关系，侄女如果拎不清，伯父也不会特别喜欢她。侄女送房子也不是不可以，但没有送，也不可以就认为她没良心。  ,无,2020-02-21 12:17,微博 weibo.com,236,1,72
